{
  "profile": "compatibility",
  "kind": "file",
  "id": "file-easynet-docs-1",
  "object": "file",
  "bytes": 19,
  "created_at": 1783094400,
  "filename": "prompt.jsonl",
  "purpose": "batch",
  "status": "processed",
  "metadata": {
    "profile": "compatibility",
    "source": "compatibility.file",
    "owner_ura": "easynet:///r/example/agent/alice.sdk",
    "content_type": "application/jsonl",
    "content_hash": "sha256:aaaaaaaaaaaaaaaaaaaaaaaaaaaaaaaaaaaaaaaaaaaaaaaaaaaaaaaaaaaaaaaa",
    "file_ref": "easynet:///r/example/resource/alice.files/prompt.jsonl"
  }
}
