{
  "profile": "compatibility",
  "kind": "chat_completion",
  "id": "chatcmpl-example",
  "object": "chat.completion",
  "created": 1,
  "model": "easynet:///r/example/ability/alice.codex.chat",
  "choices": [
    {
      "index": 0,
      "message": {
        "role": "assistant",
        "content": "ok"
      },
      "finish_reason": "stop"
    }
  ],
  "usage": {
    "prompt_tokens": 3,
    "completion_tokens": 1,
    "total_tokens": 4
  },
  "metadata": {
    "profile": "compatibility",
    "source": "openai.chat_completions",
    "easynet_user_ura": "easynet:///r/example/user/alice"
  }
}
