{
  "profile": "compatibility",
  "kind": "model_page",
  "object": "list",
  "data": [
    {
      "profile": "compatibility",
      "kind": "model",
      "id": "easynet:///r/example/ability/alice.codex.chat",
      "object": "model",
      "created": 0,
      "owned_by": "easynet",
      "ability_ref": "easynet:///r/example/ability/alice.codex.chat",
      "metadata": {
        "profile": "compatibility",
        "source": "openai.list_models",
        "daemon_ability": "codex.chat",
        "raw_model": {
          "id": "easynet:///r/example/ability/alice.codex.chat",
          "object": "model",
          "created": 0,
          "owned_by": "easynet",
          "ability": "codex.chat"
        }
      }
    }
  ],
  "next_cursor": null,
  "metadata": {
    "profile": "compatibility",
    "source": "openai.list_models",
    "count": 1
  }
}
