{
  "profile": "compatibility",
  "kind": "chat_completion_stream",
  "stream": true,
  "items": [
    {
      "profile": "compatibility",
      "kind": "chat_completion_chunk",
      "id": "chatcmpl-example",
      "object": "chat.completion.chunk",
      "created": 1,
      "model": "easynet:///r/example/ability/alice.codex.chat",
      "choices": [
        {
          "index": 0,
          "delta": {
            "role": "assistant"
          },
          "finish_reason": null
        }
      ],
      "usage": null,
      "metadata": {
        "profile": "compatibility",
        "source": "openai.chat_completions"
      }
    }
  ],
  "done_sentinel": "[DONE]",
  "metadata": {
    "profile": "compatibility",
    "source": "openai.chat_completions",
    "easynet_user_ura": null
  }
}
